{
  "schema_version": "1.1",
  "case_id": "EXP-DEMO-0001",
  "procedure_type": "aex_gestprestaciones_bada",
  "case_context": {
    "domain": "asistencia_sanitaria_migrantes",
    "language_expected": ["es"],
    "country": "ES"
  },
  "expected_document_map": [
    { "document_type": "ae_ciu_sol_prestacion", "required": true },
    { "document_type": "ae_ciu_ide_identificativo", "required": true },
    { "document_type": "ae_con_cer_rgecivil", "required": true },
    { "document_type": "ae_ciu_acr_residencia", "required": true },
    { "document_type": "ae_ciu_acr_acreditativo", "required": true },
    { "document_type": "ae_con_cer_vinculoconyugal", "required": "condicional" },
    { "document_type": "ae_con_cer_discapacidad", "required": "condicional" }
  ],
  "document_inventory": [
    {
      "document_id": "DOC-0001",
      "document_type_pred": "ae_ciu_sol_prestacion",
      "origin": {
        "source_format": "scan",
        "file_name": "C-157_solicitud.pdf",
        "page_count": 1
      },
      "document_metadata": {
        "issuer_org": "INSS",
        "language": "es",
        "signature_status": "firma_manuscrita"
      },
      "pages": [
        {
          "page_number": 1,
          "blocks": [
            {
              "block_id": "DOC-0001-P01-B001",
              "block_type": "title",
              "text": "Solicitud de asistencia sanitaria para migrantes en estancia temporal en España (formulario C-157)",
              "bbox": { "x0": 100, "y0": 60, "x1": 900, "y1": 120, "unit": "pixel" },
              "reading_order": 1,
              "semantics": { "section": "cabecera" }
            },
            {
              "block_id": "DOC-0001-P01-B002",
              "block_type": "form_field",
              "label": "DNI",
              "text": "DNI del solicitante: 12345678Z",
              "bbox": { "x0": 412, "y0": 826, "x1": 890, "y1": 904, "unit": "pixel" },
              "reading_order": 2,
              "semantics": { "entity_type": "dni", "section": "datos_solicitante", "required_for_bastanteo": true }
            },
            {
              "block_id": "DOC-0001-P01-B003",
              "block_type": "paragraph",
              "text": "Motivo de la solicitud: asistencia sanitaria durante la estancia temporal en España del pensionista español de origen residente en el extranjero.",
              "bbox": { "x0": 100, "y0": 950, "x1": 900, "y1": 1000, "unit": "pixel" },
              "reading_order": 3,
              "semantics": { "section": "alegaciones" }
            },
            {
              "block_id": "DOC-0001-P01-B004",
              "block_type": "paragraph",
              "text": "Declaro que son ciertos los datos incluidos en esta solicitud. Si doy mi consentimiento para consultar y recabar electrónicamente los datos en poder de otras administraciones.",
              "bbox": { "x0": 100, "y0": 1050, "x1": 900, "y1": 1120, "unit": "pixel" },
              "reading_order": 4,
              "semantics": { "section": "consentimiento" }
            },
            {
              "block_id": "DOC-0001-P01-B005",
              "block_type": "signature",
              "text": "Firma manuscrita del solicitante presente al pie del documento.",
              "bbox": { "x0": 700, "y0": 3100, "x1": 950, "y1": 3300, "unit": "pixel" },
              "reading_order": 5,
              "semantics": { "entity_type": "signature_presence", "section": "cierre" }
            }
          ]
        }
      ]
    },
    {
      "document_id": "DOC-0002",
      "document_type_pred": "ae_con_cer_rgecivil",
      "origin": { "source_format": "scan", "file_name": "certificado_nacimiento.pdf", "page_count": 1 },
      "document_metadata": { "issuer_org": "Registro Civil", "language": "es" },
      "pages": [
        {
          "page_number": 1,
          "blocks": [
            {
              "block_id": "DOC-0002-P01-B001",
              "block_type": "paragraph",
              "text": "Certificación literal de nacimiento que acredita la nacionalidad española de origen del solicitante.",
              "bbox": { "x0": 100, "y0": 100, "x1": 900, "y1": 150, "unit": "pixel" },
              "reading_order": 1,
              "semantics": { "entity_type": "document_number", "section": "acreditacion_nacionalidad" }
            }
          ]
        }
      ]
    },
    {
      "document_id": "DOC-0003",
      "document_type_pred": "ae_ciu_acr_residencia",
      "origin": { "source_format": "scan", "file_name": "certificado_padron.pdf", "page_count": 1 },
      "document_metadata": { "issuer_org": "Consulado de Espana", "language": "es" },
      "pages": [
        {
          "page_number": 1,
          "blocks": [
            {
              "block_id": "DOC-0003-P01-B001",
              "block_type": "paragraph",
              "text": "Certificado de inscripción en el Padrón de Españoles Residentes en el Extranjero (PERE) del solicitante.",
              "bbox": { "x0": 100, "y0": 100, "x1": 900, "y1": 150, "unit": "pixel" },
              "reading_order": 1,
              "semantics": { "entity_type": "address", "section": "acreditacion_residencia" }
            }
          ]
        }
      ]
    },
    {
      "document_id": "DOC-0004",
      "document_type_pred": "ae_ciu_acr_acreditativo",
      "origin": { "source_format": "scan", "file_name": "certificado_laboral.pdf", "page_count": 1 },
      "document_metadata": { "issuer_org": "Consejeria de Trabajo", "language": "es" },
      "pages": [
        {
          "page_number": 1,
          "blocks": [
            {
              "block_id": "DOC-0004-P01-B001",
              "block_type": "paragraph",
              "text": "Documento oficial que acredita que el solicitante es pensionista o trabajador por cuenta ajena en el país de procedencia.",
              "bbox": { "x0": 100, "y0": 100, "x1": 900, "y1": 150, "unit": "pixel" },
              "reading_order": 1,
              "semantics": { "section": "acreditacion_laboral" }
            }
          ]
        }
      ]
    },
    {
      "document_id": "DOC-0005",
      "document_type_pred": "ae_con_cer_vinculoconyugal",
      "origin": { "source_format": "scan", "file_name": "libro_familia.pdf", "page_count": 1 },
      "document_metadata": { "issuer_org": "Registro Civil", "language": "es" },
      "pages": [
        {
          "page_number": 1,
          "blocks": [
            {
              "block_id": "DOC-0005-P01-B001",
              "block_type": "paragraph",
              "text": "Libro de familia y certificado de inscripción de matrimonio del cónyuge que acompaña al solicitante.",
              "bbox": { "x0": 100, "y0": 100, "x1": 900, "y1": 150, "unit": "pixel" },
              "reading_order": 1,
              "semantics": { "section": "vinculo_familiar" }
            }
          ]
        }
      ]
    },
    {
      "document_id": "DOC-0006",
      "document_type_pred": "ae_con_cer_discapacidad",
      "origin": { "source_format": "scan", "file_name": "certificado_discapacidad.pdf", "page_count": 1 },
      "document_metadata": { "issuer_org": "IMSERSO", "language": "es" },
      "pages": [
        {
          "page_number": 1,
          "blocks": [
            {
              "block_id": "DOC-0006-P01-B001",
              "block_type": "paragraph",
              "text": "Certificado de discapacidad del descendiente mayor de 26 años a cargo, con grado reconocido igual o superior al 65 por ciento.",
              "bbox": { "x0": 100, "y0": 100, "x1": 900, "y1": 150, "unit": "pixel" },
              "reading_order": 1,
              "semantics": { "section": "discapacidad" }
            }
          ]
        }
      ]
    }
  ]
}
